,name,fullname,shift,div,siz,dnaApos,taxonid,realm1,realm2,realm3,realm4,realm5,Ori,Ter,leading1,lagging1,lagging2,leading2,dist_dnaA_ori,frac_co_orient,median_dist_ori_rrna
168,NZ_CP094144.1,"NZ_CP094144.1 Helicobacter pylori strain Hpfe029 chromosome, complete genome",-33196,0.474744,1569932,1,210,Bacteria,Proteobacteria,delta/epsilon subdivisions,Epsilonproteobacteria,Campylobacterales,1536737,712121,"[1, 712121)","[712121, 1536737)",,"[1536737, 1569932]",33196.0,1.0,257578.5
169,NZ_CP094138.1,"NZ_CP094138.1 Helicobacter pylori strain Hpfe037 chromosome, complete genome",-18249,0.474998,1596714,1,210,Bacteria,Proteobacteria,delta/epsilon subdivisions,Epsilonproteobacteria,Campylobacterales,1578466,740188,"[1, 740188)","[740188, 1578466)",,"[1578466, 1596714]",18249.0,1.0,239993.0
170,NZ_CP094145.1,"NZ_CP094145.1 Helicobacter pylori strain Hpfe028 chromosome, complete genome",-39127,0.47916,1559487,1,210,Bacteria,Proteobacteria,delta/epsilon subdivisions,Epsilonproteobacteria,Campylobacterales,1520361,708118,"[1, 708118)","[708118, 1520361)",,"[1520361, 1559487]",39127.0,1.0,261480.0
171,NZ_CP094140.1,"NZ_CP094140.1 Helicobacter pylori strain Hpfe035 chromosome, complete genome",-17172,0.510444,1594447,1,210,Bacteria,Proteobacteria,delta/epsilon subdivisions,Epsilonproteobacteria,Campylobacterales,1577276,796705,"[1, 796705)","[796705, 1577276)",,"[1577276, 1594447]",17172.0,1.0,236400.5
172,NZ_CP094136.1,"NZ_CP094136.1 Helicobacter pylori strain Hpfe039 chromosome, complete genome",-29079,0.49289,1626225,1,210,Bacteria,Proteobacteria,delta/epsilon subdivisions,Epsilonproteobacteria,Campylobacterales,1597147,772472,"[1, 772472)","[772472, 1597147)",,"[1597147, 1626225]",29079.0,1.0,255586.0
173,NZ_CP094135.1,"NZ_CP094135.1 Helicobacter pylori strain Hpfe040 chromosome, complete genome",-13636,0.477353,1566720,1,210,Bacteria,Proteobacteria,delta/epsilon subdivisions,Epsilonproteobacteria,Campylobacterales,1553085,734243,"[1, 734243)","[734243, 1553085)",,"[1553085, 1566720]",13636.0,1.0,236016.5
174,NZ_CP094137.1,"NZ_CP094137.1 Helicobacter pylori strain Hpfe038 chromosome, complete genome",-19436,0.4997,1576311,1,210,Bacteria,Proteobacteria,delta/epsilon subdivisions,Epsilonproteobacteria,Campylobacterales,1556876,768248,"[1, 768248)","[768248, 1556876)",,"[1556876, 1576311]",19436.0,1.0,241374.5
175,NZ_CP094143.1,"NZ_CP094143.1 Helicobacter pylori strain Hpfe032 chromosome, complete genome",-14637,0.475947,1626208,1,210,Bacteria,Proteobacteria,delta/epsilon subdivisions,Epsilonproteobacteria,Campylobacterales,1611572,759353,"[1, 759353)","[759353, 1611572)",,"[1611572, 1626208]",14637.0,1.0,244685.5
176,NZ_CP094157.1,"NZ_CP094157.1 Helicobacter pylori strain Hpfe0021 chromosome, complete genome",16195,0.50851,1615406,1,210,Bacteria,Proteobacteria,delta/epsilon subdivisions,Epsilonproteobacteria,Campylobacterales,16196,837646,"[16196, 837646)","[1, 16196)","[837646, 1615406]",,16195.0,1.0,172929.5
177,NZ_CP094153.1,"NZ_CP094153.1 Helicobacter pylori strain Hpfe010 chromosome, complete genome",-16948,0.49025,1576565,1,210,Bacteria,Proteobacteria,delta/epsilon subdivisions,Epsilonproteobacteria,Campylobacterales,1559618,755964,"[1, 755964)","[755964, 1559618)",,"[1559618, 1576565]",16948.0,1.0,240297.0
178,NZ_CP094147.1,"NZ_CP094147.1 Helicobacter pylori strain Hpfe027 chromosome, complete genome",-26182,0.486354,1581641,1,210,Bacteria,Proteobacteria,delta/epsilon subdivisions,Epsilonproteobacteria,Campylobacterales,1555460,743056,"[1, 743056)","[743056, 1555460)",,"[1555460, 1581641]",26182.0,1.0,267407.0
179,NZ_CP094159.1,"NZ_CP094159.1 Helicobacter pylori strain Hpfe0020 chromosome, complete genome",-14133,0.522313,1576979,1,210,Bacteria,Proteobacteria,delta/epsilon subdivisions,Epsilonproteobacteria,Campylobacterales,1562847,809545,"[1, 809545)","[809545, 1562847)",,"[1562847, 1576979]",14133.0,1.0,230298.5
180,NZ_CP094149.1,"NZ_CP094149.1 Helicobacter pylori strain Hpfe023 chromosome, complete genome",-23182,0.533857,1608055,1,210,Bacteria,Proteobacteria,delta/epsilon subdivisions,Epsilonproteobacteria,Campylobacterales,1584874,835290,"[1, 835290)","[835290, 1584874)",,"[1584874, 1608055]",23182.0,1.0,247381.5
181,NZ_CP094151.1,"NZ_CP094151.1 Helicobacter pylori strain Hpfe019 chromosome, complete genome",-57532,0.473178,1652425,1,210,Bacteria,Proteobacteria,delta/epsilon subdivisions,Epsilonproteobacteria,Campylobacterales,1594894,724360,"[1, 724360)","[724360, 1594894)",,"[1594894, 1652425]",57532.0,1.0,283269.0
182,NZ_CP094148.1,"NZ_CP094148.1 Helicobacter pylori strain Hpfe024 chromosome, complete genome",-36017,0.504019,1595544,1,210,Bacteria,Proteobacteria,delta/epsilon subdivisions,Epsilonproteobacteria,Campylobacterales,1559528,768168,"[1, 768168)","[768168, 1559528)",,"[1559528, 1595544]",36017.0,1.0,274625.5
183,NZ_CP094150.1,"NZ_CP094150.1 Helicobacter pylori strain Hpfe022 chromosome, complete genome",-6525,0.471412,1617424,1,210,Bacteria,Proteobacteria,delta/epsilon subdivisions,Epsilonproteobacteria,Campylobacterales,1610900,755949,"[1, 755949)","[755949, 1610900)",,"[1610900, 1617424]",6525.0,1.0,232377.0
184,NZ_CP094156.1,"NZ_CP094156.1 Helicobacter pylori strain Hpfe005 chromosome, complete genome",-6280,0.462141,1595693,1,210,Bacteria,Proteobacteria,delta/epsilon subdivisions,Epsilonproteobacteria,Campylobacterales,1589414,731156,"[1, 731156)","[731156, 1589414)",,"[1589414, 1595693]",6280.0,1.0,230052.5
185,NZ_CP094160.1,"NZ_CP094160.1 Helicobacter pylori strain Hpfe0016 chromosome, complete genome",754,0.551709,1564698,1,210,Bacteria,Proteobacteria,delta/epsilon subdivisions,Epsilonproteobacteria,Campylobacterales,755,864013,"[755, 864013)","[1, 755)","[864013, 1564698]",,754.0,1.0,214761.0
186,NZ_CP094171.1,"NZ_CP094171.1 Helicobacter pylori strain Hpfe0003 chromosome, complete genome",-15423,0.504054,1564611,1,210,Bacteria,Proteobacteria,delta/epsilon subdivisions,Epsilonproteobacteria,Campylobacterales,1549189,773226,"[1, 773226)","[773226, 1549189)",,"[1549189, 1564611]",15423.0,1.0,239106.0
187,NZ_CP094172.1,"NZ_CP094172.1 Helicobacter pylori strain Hpfe0002 chromosome, complete genome",-21216,0.480372,1615482,1,210,Bacteria,Proteobacteria,delta/epsilon subdivisions,Epsilonproteobacteria,Campylobacterales,1594267,754817,"[1, 754817)","[754817, 1594267)",,"[1594267, 1615482]",21216.0,1.0,244109.5
188,NZ_CP094167.1,"NZ_CP094167.1 Helicobacter pylori strain Hpfe0007 chromosome, complete genome",-20846,0.494949,1562287,1,210,Bacteria,Proteobacteria,delta/epsilon subdivisions,Epsilonproteobacteria,Campylobacterales,1541442,752407,"[1, 752407)","[752407, 1541442)",,"[1541442, 1562287]",20846.0,1.0,243012.5
189,NZ_CP094170.1,"NZ_CP094170.1 Helicobacter pylori strain Hpfe0004 chromosome, complete genome",-31663,0.534238,1560175,1,210,Bacteria,Proteobacteria,delta/epsilon subdivisions,Epsilonproteobacteria,Campylobacterales,1528513,801843,"[1, 801843)","[801843, 1528513)",,"[1528513, 1560175]",31663.0,1.0,253062.5
190,NZ_CP094165.1,"NZ_CP094165.1 Helicobacter pylori strain Hpfe0011 chromosome, complete genome",2009,0.574016,1621961,1,210,Bacteria,Proteobacteria,delta/epsilon subdivisions,Epsilonproteobacteria,Campylobacterales,2010,933042,"[2010, 933042)","[1, 2010)","[933042, 1621961]",,2009.0,1.0,216163.0
191,NZ_CP094161.1,"NZ_CP094161.1 Helicobacter pylori strain Hpfe0015 chromosome, complete genome",-20096,0.454849,1559326,1,210,Bacteria,Proteobacteria,delta/epsilon subdivisions,Epsilonproteobacteria,Campylobacterales,1539231,689163,"[1, 689163)","[689163, 1539231)",,"[1539231, 1559326]",20096.0,1.0,241937.5
192,NZ_CP094164.1,"NZ_CP094164.1 Helicobacter pylori strain Hpfe0012 chromosome, complete genome",-15466,0.479781,1627795,1,210,Bacteria,Proteobacteria,delta/epsilon subdivisions,Epsilonproteobacteria,Campylobacterales,1612330,765520,"[1, 765520)","[765520, 1612330)",,"[1612330, 1627795]",15466.0,1.0,238682.0
193,NZ_CP094168.1,"NZ_CP094168.1 Helicobacter pylori strain Hpfe0006 chromosome, complete genome",-34983,0.528758,1559682,1,210,Bacteria,Proteobacteria,delta/epsilon subdivisions,Epsilonproteobacteria,Campylobacterales,1524700,789712,"[1, 789712)","[789712, 1524700)",,"[1524700, 1559682]",34983.0,1.0,254510.0
194,NZ_CP094163.1,"NZ_CP094163.1 Helicobacter pylori strain Hpfe0013 chromosome, complete genome",-21507,0.544524,1613738,1,210,Bacteria,Proteobacteria,delta/epsilon subdivisions,Epsilonproteobacteria,Campylobacterales,1592232,857213,"[1, 857213)","[857213, 1592232)",,"[1592232, 1613738]",21507.0,1.0,263580.0
195,NZ_CP094173.1,"NZ_CP094173.1 Helicobacter pylori strain Hpfe0001 chromosome, complete genome",-37980,0.527565,1649958,1,210,Bacteria,Proteobacteria,delta/epsilon subdivisions,Epsilonproteobacteria,Campylobacterales,1611979,832481,"[1, 832481)","[832481, 1611979)",,"[1611979, 1649958]",37980.0,1.0,296859.5
196,NZ_CP090007.1,"NZ_CP090007.1 Streptococcus salivarius strain SALI-10 chromosome, complete genome",-966680,0.499047,2096968,1120967,1304,Bacteria,Terrabacteria group,Firmicutes,Bacilli,Lactobacillales,1130289,79807,"[1, 79807)","[79807, 1130289)",,"[1130289, 2096968]",9322.0,1.0,149893.0
